{
  "schema_version": "national-jurisprudence-topology-v1",
  "topology_version": "2026-09-02",
  "collections": [
    {
      "collection_id": "collection:cnj:jurisprudence",
      "authority_id": "authority:cnj",
      "branch": "national_council",
      "degree": "unknown",
      "document_types": [
        "jurisprudence"
      ],
      "period_start": null,
      "period_end": null,
      "surface_ids": [
        "surface:cnj:official"
      ],
      "provider_ids": [],
      "status": "candidate",
      "evidence_ids": [
        "court-catalog:cnj"
      ]
    },
    {
      "collection_id": "collection:stf:jurisprudence",
      "authority_id": "authority:stf",
      "branch": "constitutional",
      "degree": "unknown",
      "document_types": [
        "jurisprudence"
      ],
      "period_start": null,
      "period_end": null,
      "surface_ids": [
        "surface:stf:official"
      ],
      "provider_ids": [
        "stf_juris"
      ],
      "status": "implemented",
      "evidence_ids": [
        "court-catalog:stf"
      ]
    },
    {
      "collection_id": "collection:stj:jurisprudence",
      "authority_id": "authority:stj",
      "branch": "superior",
      "degree": "unknown",
      "document_types": [
        "jurisprudence"
      ],
      "period_start": null,
      "period_end": null,
      "surface_ids": [
        "surface:stj:official"
      ],
      "provider_ids": [
        "stj_scon",
        "stj_dados_abertos_jurisprudencia"
      ],
      "status": "implemented",
      "evidence_ids": [
        "court-catalog:stj"
      ]
    },
    {
      "collection_id": "collection:stm:jurisprudence",
      "authority_id": "authority:stm",
      "branch": "military",
      "degree": "unknown",
      "document_types": [
        "jurisprudence"
      ],
      "period_start": null,
      "period_end": null,
      "surface_ids": [
        "surface:stm:official"
      ],
      "provider_ids": [
        "stm_jurisprudencia"
      ],
      "status": "implemented",
      "evidence_ids": [
        "court-catalog:stm"
      ]
    },
    {
      "collection_id": "collection:tjac:jurisprudence",
      "authority_id": "authority:tjac",
      "branch": "state",
      "degree": "unknown",
      "document_types": [
        "jurisprudence"
      ],
      "period_start": null,
      "period_end": null,
      "surface_ids": [
        "surface:tjac:official"
      ],
      "provider_ids": [
        "tjac_cjsg"
      ],
      "status": "implemented",
      "evidence_ids": [
        "court-catalog:tjac"
      ]
    },
    {
      "collection_id": "collection:tjal:jurisprudence",
      "authority_id": "authority:tjal",
      "branch": "state",
      "degree": "unknown",
      "document_types": [
        "jurisprudence"
      ],
      "period_start": null,
      "period_end": null,
      "surface_ids": [
        "surface:tjal:official"
      ],
      "provider_ids": [
        "tjal_cjsg"
      ],
      "status": "implemented",
      "evidence_ids": [
        "court-catalog:tjal"
      ]
    },
    {
      "collection_id": "collection:tjam:jurisprudence",
      "authority_id": "authority:tjam",
      "branch": "state",
      "degree": "unknown",
      "document_types": [
        "jurisprudence"
      ],
      "period_start": null,
      "period_end": null,
      "surface_ids": [
        "surface:tjam:official"
      ],
      "provider_ids": [
        "tjam_cjsg"
      ],
      "status": "implemented",
      "evidence_ids": [
        "court-catalog:tjam"
      ]
    },
    {
      "collection_id": "collection:tjap:jurisprudence",
      "authority_id": "authority:tjap",
      "branch": "state",
      "degree": "unknown",
      "document_types": [
        "jurisprudence"
      ],
      "period_start": null,
      "period_end": null,
      "surface_ids": [
        "surface:tjap:official"
      ],
      "provider_ids": [],
      "status": "candidate",
      "evidence_ids": [
        "court-catalog:tjap"
      ]
    },
    {
      "collection_id": "collection:tjba:jurisprudence",
      "authority_id": "authority:tjba",
      "branch": "state",
      "degree": "unknown",
      "document_types": [
        "jurisprudence"
      ],
      "period_start": null,
      "period_end": null,
      "surface_ids": [
        "surface:tjba:official"
      ],
      "provider_ids": [
        "tjba_graphql"
      ],
      "status": "implemented",
      "evidence_ids": [
        "court-catalog:tjba"
      ]
    },
    {
      "collection_id": "collection:tjce:jurisprudence",
      "authority_id": "authority:tjce",
      "branch": "state",
      "degree": "unknown",
      "document_types": [
        "jurisprudence"
      ],
      "period_start": null,
      "period_end": null,
      "surface_ids": [
        "surface:tjce:official"
      ],
      "provider_ids": [],
      "status": "candidate",
      "evidence_ids": [
        "court-catalog:tjce"
      ]
    },
    {
      "collection_id": "collection:tjdft:jurisprudence",
      "authority_id": "authority:tjdft",
      "branch": "state",
      "degree": "unknown",
      "document_types": [
        "jurisprudence"
      ],
      "period_start": null,
      "period_end": null,
      "surface_ids": [
        "surface:tjdft:official"
      ],
      "provider_ids": [
        "tjdf_juris"
      ],
      "status": "implemented",
      "evidence_ids": [
        "court-catalog:tjdft"
      ]
    },
    {
      "collection_id": "collection:tjes:jurisprudence",
      "authority_id": "authority:tjes",
      "branch": "state",
      "degree": "unknown",
      "document_types": [
        "jurisprudence"
      ],
      "period_start": null,
      "period_end": null,
      "surface_ids": [
        "surface:tjes:official"
      ],
      "provider_ids": [
        "tjes_cjpg",
        "tjes_jurisprudencia",
        "tjes_turma_recursal"
      ],
      "status": "candidate",
      "evidence_ids": [
        "court-catalog:tjes"
      ]
    },
    {
      "collection_id": "collection:tjgo:jurisprudence",
      "authority_id": "authority:tjgo",
      "branch": "state",
      "degree": "unknown",
      "document_types": [
        "jurisprudence"
      ],
      "period_start": null,
      "period_end": null,
      "surface_ids": [
        "surface:tjgo:official"
      ],
      "provider_ids": [
        "tjgo_projudi_jurisprudencia"
      ],
      "status": "implemented",
      "evidence_ids": [
        "court-catalog:tjgo"
      ]
    },
    {
      "collection_id": "collection:tjma:jurisprudence",
      "authority_id": "authority:tjma",
      "branch": "state",
      "degree": "unknown",
      "document_types": [
        "jurisprudence"
      ],
      "period_start": null,
      "period_end": null,
      "surface_ids": [
        "surface:tjma:official"
      ],
      "provider_ids": [],
      "status": "candidate",
      "evidence_ids": [
        "court-catalog:tjma"
      ]
    },
    {
      "collection_id": "collection:tjmg:jurisprudence",
      "authority_id": "authority:tjmg",
      "branch": "state",
      "degree": "unknown",
      "document_types": [
        "jurisprudence"
      ],
      "period_start": null,
      "period_end": null,
      "surface_ids": [
        "surface:tjmg:official"
      ],
      "provider_ids": [],
      "status": "candidate",
      "evidence_ids": [
        "court-catalog:tjmg"
      ]
    },
    {
      "collection_id": "collection:tjmmg:jurisprudence",
      "authority_id": "authority:tjmmg",
      "branch": "military",
      "degree": "unknown",
      "document_types": [
        "jurisprudence"
      ],
      "period_start": null,
      "period_end": null,
      "surface_ids": [
        "surface:tjmmg:official"
      ],
      "provider_ids": [],
      "status": "candidate",
      "evidence_ids": [
        "court-catalog:tjmmg"
      ]
    },
    {
      "collection_id": "collection:tjmrs:jurisprudence",
      "authority_id": "authority:tjmrs",
      "branch": "military",
      "degree": "unknown",
      "document_types": [
        "jurisprudence"
      ],
      "period_start": null,
      "period_end": null,
      "surface_ids": [
        "surface:tjmrs:official"
      ],
      "provider_ids": [],
      "status": "candidate",
      "evidence_ids": [
        "court-catalog:tjmrs"
      ]
    },
    {
      "collection_id": "collection:tjms:jurisprudence",
      "authority_id": "authority:tjms",
      "branch": "state",
      "degree": "unknown",
      "document_types": [
        "jurisprudence"
      ],
      "period_start": null,
      "period_end": null,
      "surface_ids": [
        "surface:tjms:official"
      ],
      "provider_ids": [
        "tjms_cjsg"
      ],
      "status": "implemented",
      "evidence_ids": [
        "court-catalog:tjms"
      ]
    },
    {
      "collection_id": "collection:tjmsp:jurisprudence",
      "authority_id": "authority:tjmsp",
      "branch": "military",
      "degree": "unknown",
      "document_types": [
        "jurisprudence"
      ],
      "period_start": null,
      "period_end": null,
      "surface_ids": [
        "surface:tjmsp:official"
      ],
      "provider_ids": [],
      "status": "candidate",
      "evidence_ids": [
        "court-catalog:tjmsp"
      ]
    },
    {
      "collection_id": "collection:tjmt:jurisprudence",
      "authority_id": "authority:tjmt",
      "branch": "state",
      "degree": "unknown",
      "document_types": [
        "jurisprudence"
      ],
      "period_start": null,
      "period_end": null,
      "surface_ids": [
        "surface:tjmt:official"
      ],
      "provider_ids": [],
      "status": "candidate",
      "evidence_ids": [
        "court-catalog:tjmt"
      ]
    },
    {
      "collection_id": "collection:tjpa:jurisprudence",
      "authority_id": "authority:tjpa",
      "branch": "state",
      "degree": "unknown",
      "document_types": [
        "jurisprudence"
      ],
      "period_start": null,
      "period_end": null,
      "surface_ids": [